product_name;generic_name;nutrition_grade_fr;stores;url
Biscuit Pomme Noisette;Biscuits;a;Franprix,Magasins U,Leclerc,E Leclerc,Delhaize;https://fr.openfoodfacts.org/produit/3175681851849/biscuit-pomme-noisette-gerble
Biscuits Figue et son;Biscuits;a;Franprix,Magasins U,Carrefour;https://fr.openfoodfacts.org/produit/3251490332080/biscuits-figue-et-son-gerble
P'tit Nature Complet;;a;Magasins U,carrefour,leclerc;https://fr.openfoodfacts.org/produit/3229820021027/p-tit-nature-complet-bjorg
Goûter 4s aux pommes;Biscuits aux pommes, très pauvres en sel;a;super u, Magasins U;https://fr.openfoodfacts.org/produit/3175681209282/gouter-4s-aux-pommes-gerble
Biscuits aux pépites de chocolat;Biscuits de son d'avoine (65%) aux pépites de chocolat (12,5%) avec édulcorants;a;;https://fr.openfoodfacts.org/produit/3760151011429/biscuits-aux-pepites-de-chocolat-dukan
Farine de blé fluide l'originale T45;Farines de blé type T45;a;Monoprix,Simply Market,Magasins U,Tous;https://fr.openfoodfacts.org/produit/3068110801235/farine-de-ble-fluide-l-originale-t45-francine
Mon flan entremets au chocolat;Préparation pour mon flan entremets au chocolat;a;Carrefour Market,intermarché, Magasins U;https://fr.openfoodfacts.org/produit/3027030028672/mon-flan-entremets-au-chocolat-ancel
Biscuits nappés de chocolat;Biscuits sucrés;a;Magasins U;https://fr.openfoodfacts.org/produit/3760151013287/biscuits-nappes-de-chocolat-dukan
Langues de chat;Biscuit langues de chat;a;Carrefour;https://fr.openfoodfacts.org/produit/3456300006537/langues-de-chat-karelea
Biscuits aux éclats de noisettes;Biscuits avec édulcorants;a;;https://fr.openfoodfacts.org/produit/3760151011054/biscuits-aux-eclats-de-noisettes-dukan
Galletas de desayuno con cereales integrales;;a;;https://fr.openfoodfacts.org/produit/8410376042498/galletas-de-desayuno-con-cereales-integrales-gullon
Les craquelins de saint malo;;a;Carrefour, Magasins U;https://fr.openfoodfacts.org/produit/3300081001208/les-craquelins-de-saint-malo
Diet fibra galletas sin azúcares;;a;;https://fr.openfoodfacts.org/produit/8410376001952/diet-fibra-galletas-sin-azucares-gullon
Biscuits à la noix de coco;;a;;https://fr.openfoodfacts.org/produit/3760151011047/biscuits-a-la-noix-de-coco-dukan
Mini Cookies aux Pepites de Chocolat;Chocolat biscuit;a;czsino,Magasins U;https://fr.openfoodfacts.org/produit/3760151013829/mini-cookies-aux-pepites-de-chocolat-dukan
Weetabix Protein;;a;Cora, Magasins U;https://fr.openfoodfacts.org/produit/5010029222005/weetabix-protein
Goûter 4S aux pommes;Biscuits à teneur réduite en sucres et très pauvres en sel, source de potassium;a;Carrefour;https://fr.openfoodfacts.org/produit/3251490304001/gouter-4s-aux-pommes-gerble
Gâteau Gourmet aux Amandes à l'Orange;Gâteau;a;Naturalia;https://fr.openfoodfacts.org/produit/3571375932250/gateau-gourmet-aux-amandes-a-l-orange-biscuiterie-de-provence
Biscuits au pur son d'avoine aux pépites de chocolat;;a;Magasins U;https://fr.openfoodfacts.org/produit/3760151014017/biscuits-au-pur-son-d-avoine-aux-pepites-de-chocolat-dukan
Biscuits au pur son d'avoine graines et fleur d'hibiscus;;a;Magasins U;https://fr.openfoodfacts.org/produit/3760151014260/biscuits-au-pur-son-d-avoine-graines-et-fleur-d-hibiscus-dukan
Biscuit de son d'avoine saveur miel Gayelord Hauser;Biscuit diététique;a;Hyper U;https://fr.openfoodfacts.org/produit/3229820786162/biscuit-de-son-d-avoine-saveur-miel-gayelord-hauser
Orange graines de chia;;a;;https://fr.openfoodfacts.org/produit/3175681257511/orange-graines-de-chia-gerble
Galletas digestive con arándanos;;a;;https://fr.openfoodfacts.org/produit/8412170026841/galletas-digestive-con-arandanos-santiveri
Mini Malo Nature Les Craquelins de Saint Malo;Mini Toasts;a;Monoprix, Magasins U;https://fr.openfoodfacts.org/produit/3300085002201/mini-malo-nature-les-craquelins-de-saint-malo
Frollini con farina integrale e cioccolato;;a;;https://fr.openfoodfacts.org/produit/8076809573191/frollini-con-farina-integrale-e-cioccolato-mulino-bianco
Carrés coupe faim minceur Cacao Gayelord Hauser;Carrés coupe faim minceur Cacao;a;Monoprix;https://fr.openfoodfacts.org/produit/3229820189246/carres-coupe-faim-minceur-cacao-gayelord-hauser
Avenacol;;a;;https://fr.openfoodfacts.org/produit/8434165494640/avenacol-cuetara
Le Craquelins de Saint Malo Gout Sucré;;a;Carrefour,Magasins U;https://fr.openfoodfacts.org/produit/3300081002205/le-craquelins-de-saint-malo-gout-sucre-les-craquelins-de-saint-malo
Flan préparation pour entremets au café;préparation pour entremets au café;a;Carrefour Market;https://fr.openfoodfacts.org/produit/3287180002025/flan-preparation-pour-entremets-au-cafe-abbaye-de-la-coudre
Muffin anglais;;a;;https://fr.openfoodfacts.org/produit/4009249040071/muffin-anglais-golden-toast
Digestive avena Ligera;Galleta con cereales Digestive de avena sin sal añadida;a;Alcampo,Carrefour,El Corte Inglés,Hipercor,Caprabo;https://fr.openfoodfacts.org/produit/8410376047530/digestive-avena-ligera-gullon
Galletas digestive con avena azúcares añadidos;;a;;https://fr.openfoodfacts.org/produit/8412170027107/galletas-digestive-con-avena-azucares-anadidos-santiveri
Biscuits Petit-Déjeuner Yaourt aux Céréales Complètes - Sans Sucres Ajoutés;Biscuits pour Petit-Déjeuner avec fourrage de lait saveur yaourt sans sucre avec édulcorant;a;Noz;https://fr.openfoodfacts.org/produit/0795130046461/biscuits-petit-dejeuner-yaourt-aux-cereales-completes-sans-sucres-ajoutes-gullon
Légumes pour Couscous;Pains d'épices;a;Lidl;https://fr.openfoodfacts.org/produit/20758356/legumes-pour-couscous-freshona
Feuille De Baklava 500 GR X 20 Arev;;a;;https://fr.openfoodfacts.org/produit/3760077150134/feuille-de-baklava-500-gr-x-20-arev-murat
Petits pains toast, au froment;;a;Lidl;https://fr.openfoodfacts.org/produit/20322601/petits-pains-toast-au-froment-lidl
Mulino Bianco Frollini Con Yogurt E Cereali;;a;;https://fr.openfoodfacts.org/produit/8076809573160/mulino-bianco-frollini-con-yogurt-e-cereali
Mini craquelins;;a;;https://fr.openfoodfacts.org/produit/3300085010305/mini-craquelins-la-trinitaine
4 muffins citron & pavot;Petits pains spéciaux aux écorces d'agrumes et graines de pavot;a;Intermarché;https://fr.openfoodfacts.org/produit/3513851559162/4-muffins-citron-pavot-regent-s-park
Biscuits de Son d'avoine saveur speculoos;Biscuits de Son d'avoine saveur speculoos avec édulcorants;a;CASINO;https://fr.openfoodfacts.org/produit/3760151012518/biscuits-de-son-d-avoine-saveur-speculoos-dukan
Crumble de saison;Crumbles aux légumes;a;;https://fr.openfoodfacts.org/produit/3760253460248/crumble-de-saison-l-atelier-v
Crème pâtissière;;a;;https://fr.openfoodfacts.org/produit/6111180013613/creme-patissiere-ideal
Biscuit citron;;a;;https://fr.openfoodfacts.org/produit/3423720032057/biscuit-citron-bio-soleil
Biscuits noisettes & Raisins;Nature&Bienfaits Biscuits Noisettes & Rasins;a;;https://fr.openfoodfacts.org/produit/3423720032019/biscuits-noisettes-raisins-bio-soleil
Biscuits Cranberries;;a;;https://fr.openfoodfacts.org/produit/3423720032040/biscuits-cranberries-bio-soleil
Mini Malo Pavot et graines de lin Les Craquelins de Saint Malo;Mini Toasts Pavot et graines de lin;a;Monoprix;https://fr.openfoodfacts.org/produit/3300085005301/mini-malo-pavot-et-graines-de-lin-les-craquelins-de-saint-malo
Biscuits 3 graines;;a;;https://fr.openfoodfacts.org/produit/3760020504748/biscuits-3-graines-karelea
Mug cake protéiné;Mug cake protéiné;a;;https://fr.openfoodfacts.org/produit/5055936868434/mug-cake-proteine-myprotein
High Protein Donut;Donut protéiné;a;;https://fr.openfoodfacts.org/produit/5060523490011/high-protein-donut-jim-buddy-s
High protein donut;Donut protéiné;a;;https://fr.openfoodfacts.org/produit/5060523490028/high-protein-donut-jim-buddy-s
